{
  "$formspec": "1.0",
  "url": "https://example.gov/forms/fragments/contact-fragment",
  "version": "1.0.0",
  "versionAlgorithm": "semver",
  "status": "active",
  "title": "Grant Application Contact Fragment",
  "description": "Reusable contact information fields for grant application sections.",
  "date": "2026-02-28",
  "name": "grant-contact-fragment",
  "items": [
    {
      "type": "group",
      "key": "contactCore",
      "label": "Contact Core",
      "children": [
        {
          "type": "field",
          "key": "name",
          "label": "Contact Name",
          "dataType": "string"
        },
        {
          "type": "field",
          "key": "email",
          "label": "Contact Email",
          "dataType": "string",
          "semanticType": "email"
        },
        {
          "type": "field",
          "key": "phone",
          "label": "Contact Phone",
          "dataType": "string",
          "semanticType": "phone"
        }
      ]
    }
  ]
}
